{
  "schema_version": 1,
  "artifact_id": "domainlease-r11-scenario-profile-v1",
  "profile_epoch": 1,
  "status": "draft_pending_independent_review",
  "owner_role": "external_scenario_profile_authority",
  "compatible_policy": {
    "artifact_id": "domainlease-r11-semantic-policy-v1",
    "policy_epoch": 1
  },
  "strategy": {
    "kind": "decomposed_finite_projection_suite",
    "monolithic_cartesian_product_required": false,
    "shared_semantics_required": true,
    "composition_obligations_required": true,
    "reason": "avoid_state_explosion_without_collapsing_security_distinctions_or_liveness_antecedents"
  },
  "mode_catalog": {
    "async_mode": ["NONE", "SYNC", "DISTINCT", "ALIASED"],
    "partition_mode": ["LOCAL_ONLY", "CONNECTED_ONLY", "CONTINUE_TO_CONSERVATIVE_EXPIRY", "RECOVERY_ONLY"],
    "transfer_mode": ["NONE", "STRONG_CONTINUITY", "SAFE_GAP", "CONTINUITY_LOST"],
    "reclaim_mode": ["NONE", "NAMESPACE_GC", "RESTART_RECONCILIATION"],
    "failure_mode": ["NONE", "SINGLE", "OVERLAP_AND_DISJOINT"],
    "workload_mode": ["MANAGEMENT", "AUTHORITY_CONTROL", "GUARANTEED", "MIXED", "RECOVERY"]
  },
  "profile_mode_contract": [
    {"profile":"PROFILE-W0-BOOTSTRAP","async_mode":"SYNC","partition_mode":"LOCAL_ONLY","transfer_mode":"NONE","reclaim_mode":"NONE","failure_mode":"NONE","workload_mode":"MANAGEMENT"},
    {"profile":"PROFILE-W1-AUTHORITY-TXN","async_mode":"NONE","partition_mode":"LOCAL_ONLY","transfer_mode":"NONE","reclaim_mode":"NONE","failure_mode":"NONE","workload_mode":"AUTHORITY_CONTROL"},
    {"profile":"PROFILE-W2-ASYNC-DISTINCT","async_mode":"DISTINCT","partition_mode":"LOCAL_ONLY","transfer_mode":"NONE","reclaim_mode":"NONE","failure_mode":"NONE","workload_mode":"GUARANTEED"},
    {"profile":"PROFILE-W3-ASYNC-ALIASED","async_mode":"ALIASED","partition_mode":"LOCAL_ONLY","transfer_mode":"NONE","reclaim_mode":"NONE","failure_mode":"NONE","workload_mode":"GUARANTEED"},
    {"profile":"PROFILE-W4-FULL-ENTRY","async_mode":"SYNC","partition_mode":"LOCAL_ONLY","transfer_mode":"NONE","reclaim_mode":"NONE","failure_mode":"NONE","workload_mode":"GUARANTEED"},
    {"profile":"PROFILE-W5-CANCEL-RACES","async_mode":"SYNC","partition_mode":"LOCAL_ONLY","transfer_mode":"NONE","reclaim_mode":"NONE","failure_mode":"NONE","workload_mode":"GUARANTEED"},
    {"profile":"PROFILE-W6-RETRY-RECURRENCE","async_mode":"SYNC","partition_mode":"LOCAL_ONLY","transfer_mode":"NONE","reclaim_mode":"NONE","failure_mode":"NONE","workload_mode":"GUARANTEED"},
    {"profile":"PROFILE-W7-RUNTIME-SETTLEMENT","async_mode":"SYNC","partition_mode":"LOCAL_ONLY","transfer_mode":"NONE","reclaim_mode":"NONE","failure_mode":"NONE","workload_mode":"MIXED"},
    {"profile":"PROFILE-W8-REVOKE-OFFLINE","async_mode":"SYNC","partition_mode":"LOCAL_ONLY","transfer_mode":"NONE","reclaim_mode":"NONE","failure_mode":"SINGLE","workload_mode":"MIXED"},
    {"profile":"PROFILE-W9-TWO-LANE","async_mode":"SYNC","partition_mode":"LOCAL_ONLY","transfer_mode":"NONE","reclaim_mode":"NONE","failure_mode":"SINGLE","workload_mode":"MIXED"},
    {"profile":"PROFILE-W10-FAILURE-CLOSURE","async_mode":"NONE","partition_mode":"LOCAL_ONLY","transfer_mode":"NONE","reclaim_mode":"NONE","failure_mode":"OVERLAP_AND_DISJOINT","workload_mode":"RECOVERY"},
    {"profile":"PROFILE-W11-TRANSFER-STRONG","async_mode":"NONE","partition_mode":"LOCAL_ONLY","transfer_mode":"STRONG_CONTINUITY","reclaim_mode":"NONE","failure_mode":"SINGLE","workload_mode":"GUARANTEED"},
    {"profile":"PROFILE-W11-TRANSFER-SAFE-GAP","async_mode":"NONE","partition_mode":"LOCAL_ONLY","transfer_mode":"SAFE_GAP","reclaim_mode":"NONE","failure_mode":"SINGLE","workload_mode":"GUARANTEED"},
    {"profile":"PROFILE-W11-TRANSFER-CONTINUITY-LOSS","async_mode":"NONE","partition_mode":"LOCAL_ONLY","transfer_mode":"CONTINUITY_LOST","reclaim_mode":"NONE","failure_mode":"SINGLE","workload_mode":"GUARANTEED"},
    {"profile":"PROFILE-W12-PARTITION-CONNECTED-ONLY","async_mode":"NONE","partition_mode":"CONNECTED_ONLY","transfer_mode":"NONE","reclaim_mode":"NONE","failure_mode":"SINGLE","workload_mode":"MIXED"},
    {"profile":"PROFILE-W12-PARTITION-CONSERVATIVE-EXPIRY","async_mode":"NONE","partition_mode":"CONTINUE_TO_CONSERVATIVE_EXPIRY","transfer_mode":"NONE","reclaim_mode":"NONE","failure_mode":"SINGLE","workload_mode":"GUARANTEED"},
    {"profile":"PROFILE-W12-PARTITION-RECOVERY-ONLY","async_mode":"NONE","partition_mode":"RECOVERY_ONLY","transfer_mode":"NONE","reclaim_mode":"NONE","failure_mode":"SINGLE","workload_mode":"RECOVERY"},
    {"profile":"PROFILE-W12-RECLAIM-NAMESPACE","async_mode":"NONE","partition_mode":"LOCAL_ONLY","transfer_mode":"NONE","reclaim_mode":"NAMESPACE_GC","failure_mode":"SINGLE","workload_mode":"RECOVERY"},
    {"profile":"PROFILE-W12-RECLAIM-RESTART","async_mode":"NONE","partition_mode":"LOCAL_ONLY","transfer_mode":"NONE","reclaim_mode":"RESTART_RECONCILIATION","failure_mode":"SINGLE","workload_mode":"RECOVERY"}
  ],
  "dimension_keys": [
    "clusters",
    "nodes",
    "cpus",
    "cpu_incarnations_per_cpu",
    "boot_roots",
    "management_domains",
    "tenant_domains",
    "service_domains",
    "domain_granularity_kinds",
    "subjects",
    "programs",
    "authority_accounts",
    "role_use_ordinals_per_authority",
    "budget_contexts",
    "resource_value_levels",
    "streams",
    "occurrences_per_stream",
    "opportunities",
    "attempts_per_occurrence",
    "ready_cells",
    "root_frames",
    "root_slots",
    "entry_bindings",
    "quantum_generations",
    "provider_receipt_sets",
    "transaction_slots",
    "revocation_scopes",
    "failure_events",
    "failure_scopes",
    "dependency_edges",
    "transfer_records",
    "namespace_slots",
    "allocation_requests",
    "generation_values",
    "clock_domains",
    "clock_ticks",
    "audit_slots",
    "network_messages"
  ],
  "relation_catalog": [
    {"id": "REL-MGMT-TENANT-DISTINCT", "meaning": "management_and_tenant_are_distinct_domain_identities"},
    {"id": "REL-TENANT-A-B-DISTINCT", "meaning": "two_live_tenants_are_distinct"},
    {"id": "REL-CALLER-SERVICE-DISTINCT", "meaning": "caller_and_service_authority_accounts_are_distinct"},
    {"id": "REL-CALLER-SERVICE-ALIASED", "meaning": "caller_and_service_roles_share_one_authority_account_but_use_distinct_ordinals"},
    {"id": "REL-CPU-INCARNATION-CHANGES", "meaning": "offline_or_restart_uses_a_strictly_new_CPU_incarnation"},
    {"id": "REL-SOURCE-DESTINATION-DISTINCT", "meaning": "transfer_source_and_destination_nodes_are_distinct"},
    {"id": "REL-CLUSTER-A-B-DISTINCT", "meaning": "two_cluster_composition_uses_distinct_cluster_and_issuer_identities"},
    {"id": "REL-FAILURE-OVERLAP", "meaning": "two_failure_events_share_at_least_one_scope"},
    {"id": "REL-FAILURE-DISJOINT", "meaning": "a_failure_pair_has_disjoint_scopes"},
    {"id": "REL-ATTEMPT-FRESH", "meaning": "retry_never_reuses_attempt_identity_or_generation"},
    {"id": "REL-ORDINAL-INCREASING", "meaning": "recurrence_uses_a_strictly_new_stream_ordinal"},
    {"id": "REL-ROOT-SHARED", "meaning": "two_lanes_compete_for_one_conserved_root_supply"},
    {"id": "REL-LANES-DISJOINT", "meaning": "lane_local_state_and_work_reservations_are_distinct"},
    {"id": "REL-RESOURCE-ZERO-ONE-MAX", "meaning": "each_exercised_resource_component_reaches_zero_one_and_profile_max_cases"},
    {"id": "REL-NAMESPACE-EXHAUSTION", "meaning": "allocation_requests_strictly_exceed_namespace_slots_before_rekey_or_quarantine"},
    {"id": "REL-NAMESPACE-ROOTS-DISTINCT", "meaning": "one_blocked_namespace_root_cannot_block_progress_or_reuse_decisions_for_an_unrelated_root"},
    {"id": "REL-CLOCK-UNCERTAINTY-POSITIVE", "meaning": "at_least_one_cross_node_mapping_has_nonzero_uncertainty"},
    {"id": "REL-PROCESS-CONTAINER-DISTINCT", "meaning": "process_scale_and_container_scale_domains_are_distinct_profile_kinds"},
    {"id": "REL-NETWORK-SILENCE-NOT-FENCE", "meaning": "no_message_delivery_does_not_create_source_quiescence_or_destination_authority"}
  ],
  "cutpoint_catalog": [
    "CUT-PRE-CONTEXT",
    "CUT-BEFORE-PREPARE",
    "CUT-AFTER-PREPARE-BEFORE-DECISION",
    "CUT-AFTER-COMMIT-DECISION-BEFORE-APPLY",
    "CUT-DURING-APPLY",
    "CUT-AFTER-ABORT-DECISION-BEFORE-REFUND",
    "CUT-AFTER-CONTEXT-BEFORE-ELIGIBILITY",
    "CUT-AFTER-ELIGIBILITY-BEFORE-ROOT-CLAIM",
    "CUT-AFTER-ROOT-CLAIM-BEFORE-ENTRY-PREPARE",
    "CUT-AFTER-ENTRY-PREPARE-BEFORE-COMMIT",
    "CUT-AFTER-ENTERED-BEFORE-OBSERVATION",
    "CUT-ENTERED-PRE-BOUNDARY",
    "CUT-BOUNDARY-OR-IDLE-PRE-SETTLEMENT",
    "CUT-AFTER-STOP-BEFORE-SETTLEMENT",
    "CUT-AFTER-SETTLEMENT-BEFORE-LEDGER-APPLY",
    "CUT-DURING-FAILURE-CLOSURE",
    "CUT-AFTER-SOURCE-FENCE-BEFORE-QUIESCENCE",
    "CUT-AFTER-QUIESCENCE-BEFORE-DESTINATION-INSTALL",
    "CUT-AFTER-TOMBSTONE-BEFORE-REUSE"
  ],
  "cut_generation_policy": {
    "source": "future_R11_durable_action_and_projection_registry",
    "handwritten_total_cut_count_is_authoritative": false,
    "required_generated_cuts": ["before_decision", "after_abort_before_refund", "after_commit_before_first_projection", "between_each_projection", "after_effect_before_acknowledgement"],
    "second_crash_required_for": ["multi_projection_recovery", "partial_ledger_apply_recovery"],
    "offline_and_revoke_entry_cuts": ["pre_context", "context_installed_pre_eligible", "eligible_pre_claim", "claimed_pre_prepare", "prepared_pre_entry", "entered_pre_boundary", "boundary_or_idle_pre_settlement"],
    "acceptance": "generated_cut_set_equals_the_policy_derived_expected_set_exactly"
  },
  "action_class_catalog": [
    "ACTION-BOOTSTRAP-BEGIN",
    "ACTION-MANAGEMENT-ADMIT",
    "ACTION-AUTHORITY-PREPARE",
    "ACTION-AUTHORITY-COMMIT",
    "ACTION-AUTHORITY-ABORT",
    "ACTION-TRANSACTION-RECOVER",
    "ACTION-ASYNC-RESERVE",
    "ACTION-ASYNC-CARRIER",
    "ACTION-ASYNC-COALESCE",
    "ACTION-ASYNC-TERMINAL",
    "ACTION-STREAM-RELEASE",
    "ACTION-ROOT-RELEASE",
    "ACTION-ATTEMPT-PREPARE",